#CODE;ENGLISH;;;;;;;;;x 
EVTDESCB_WOL_11011;A crowd has come to witness your duel, and you enter the circle they have formed, finally facing [challenger.GetBestName]. You already know that you will stand victorious, as such a weak creature cannot possibly pose a challenge to someone like you. It's clear that [challenger.GetBestName] isn't confident in [challenger.GetHerHis] chances, as [challenger.GetSheHe] charges you and desperately swings at your garde. Easily evading the mindless slashes, you quickly end the fight by surprising your opponent with an elegant dodge, coming up behind [challenger.GetHerHim] and dealing a deadly blow to [challenger.GetHerHis] neck, decapitating [challenger.GetHerHim].;;;;;;;;;x 
EVTOPTA_WOL_11011;Schwop.;;;;;;;;;x 
EVTDESC_WOL_11012;You're well aware of your own ability, or lack of thereof, and therefore know that your duel with [From.GetBestName] will be onesided. Hoping to get the upper hand through surprise, you charge them the second they appear on the battleground. However, your sudden move doesn't faze them, and your desperate stabs are being easily parried. As [From.GetBestName] dodges one of your high blows, they get plenty of time to come up behind you and slash at your neck. There's no time to feel pain, as you fade from this world much too quickly to register your head being separated from the rest of your body.;;;;;;;;;x 
EVTOPTA_WOL_11012;Schwop.;;;;;;;;;x 
EVTDESC_WOL_11013;[FromFrom.GetBestName] has stained your honor by forcing you down into the dirt in a duel. It is only natural that you start to plan your revenge.;;;;;;;;;x 
EVTOPTA_WOL_11013;[FromFrom.GetBestName] will feel the wrath of my vengeance!;;;;;;;;;x 
EVTOPTB_WOL_11013;I'd better not make more enemies than I already have.;;;;;;;;;x 
EVTDESC_WOL_11014;[From.GetBestName] did not take lightly on being defeated in a duel. [From.GetSheHeCap] has sworn to avenge [From.GetHerHis] defeat.;;;;;;;;;x 
EVTOPTA_WOL_11014;Seems like I've made myself an enemy today.;;;;;;;;;x 
EVTOPTB_WOL_11014;Another enemy to my collection.;;;;;;;;;x 
EVTDESC_WOL_11101;You realize that to become a great fighter you would need to get in better shape. There's a great path in the nearby woods that would be excellent for running.;;;;;;;;;x 
EVTOPTA_WOL_11101;Let's go running.;;;;;;;;;x 
EVTDESC_WOL_11102;Throughout the day you've caught yourself grinding your teeth and being unable to focus on anything for long. Suddenly you realize why you have been in a bad mood all day - you just can't seem to abide having lazy people in your presence any more.;;;;;;;;;x 
EVTOPTA_WOL_11102;I'll get him to be less slothfull when I'm around.;;;;;;;;;x 
EVTOPTB_WOL_11102;It grinds my gears, but I might cause distress if I lecture people just like that.;;;;;;;;;x 
EVTDESC_WOL_11103;A small spear-throwing competition could be entertaining, and it's also a great way to enliven your battle technique. Maybe you should arrange a contest at your court?;;;;;;;;;x 
EVTOPTA_WOL_11103;My throwing arm will amaze everyone!;;;;;;;;;x 
EVTOPTB_WOL_11103;Maybe another time.;;;;;;;;;x 
EVTDESC_WOL_11104;Everyone attending the spear-throwing competition seems to be having a great time. They are partaking in the contest, conversing and laughing together. Perhaps the merryment is a bit too much, as a spear is carelessly hurled into the field as someone is still out there, measuring the distance of the previous throw.;;;;;;;;;x 
EVTOPTA_WOL_11104;Well that's unfortunate.;;;;;;;;;x 
EVTDESC_WOL_11107;After dozens of spears have been hurled through the air, a sole victor emerges. No one managed to throw farther than you!;;;;;;;;;x 
EVTOPTA_WOL_11107;This is a glorious day.;;;;;;;;;x 
EVTDESC_WOL_11109;After dozens of spears have been hurled through the air, a sole victor emerges. No one managed to throw farther than [From.GetBestName]!;;;;;;;;;x 
EVTOPTA_WOL_11109;Congratulations to [From.GetBestName];;;;;;;;;x 
EVTDESC_WOL_11110;Your daily routine involves repeatedly swinging your blade at a training dummy, however, you can only learn so much from fighting an inanimate enemy, and the practice gets dreadfully dull after a while.;;;;;;;;;x 
EVTOPTA_WOL_11110;I could use someone to train with.;;;;;;;;;x 
#EVTOPTB_WOL_11110;Though I only fight my enemies.;;;;;;;;;x 
EVTDESC_WOL_11111;As you replace your training dummy with a real person, you find that facing an intelligent enemy is a lot harder, but also more rewarding. After many bruises and cuts, it's clear that you've gained exeperince and have better control of a fight than ever before.;;;;;;;;;x 
EVTOPTA_WOL_11111;Good fighting, [From.GetBestName]!;;;;;;;;;x 
EVTDESC_WOL_11112;Even with blunt blades a training fight is a dangerous thing. Sometimes a sword might strike just a bit too hard.;;;;;;;;;x 
EVTOPTA_WOL_11112;That's enough fighting for this week.;;;;;;;;;x 
EVTDESC_WOL_11201;Having spent countless of hours swinging your sword, it is clear that your technique is getting better. You know the essence of every possible strike to utilize in a fight.;;;;;;;;;x 
EVTOPTA_WOL_11201;The hard training is paying off.;;;;;;;;;x 
EVTDESC_WOL_11202;After a long time of training both day and night, you have finally mastered the art of combat. Few could contend with your extensive knowledge of battle techniques.;;;;;;;;;x 
EVTOPTA_WOL_11202;I will be known as a duelist.;;;;;;;;;x 
EVTOPTB_WOL_11202;I think I might spend time on something else.;;;;;;;;;x 
EVTDESC_WOL_11203;Your ability to take down any man in a brawl is widely renown. Many speak of your prowess, and how it would be unwise to pick a fight with you.;;;;;;;;;x 
EVTOPTA_WOL_11203;It feels good to be recognized.;;;;;;;;;x 
EVTDESC_WOL_11204;Violence seems to be able to solve all your problems - life is easier when you can simply smash things into submission.;;;;;;;;;x 
EVTOPTA_WOL_11204;I seem to no longer have the patience to negotiate.;;;;;;;;;x 
EVTDESC_WOL_11205;As war grows to be a constant presence in your life, you have on several occasion faced, nay, almost courted, death.;;;;;;;;;x 
EVTOPTA_WOL_11205;I no longer feel fear.;;;;;;;;;x 
EVTDESCA_WOL_11206;The strict exercise regime you committed to after your decision to become a legendary warrior has made you one of the toughest persons around.;;;;;;;;;x 
EVTDESCB_WOL_11206;The strict exercise regime you committed to after your decision to become a legendary warrior has impressed people enough to no longer consider you a weakling.;;;;;;;;;x 
EVTOPTA_WOL_11206;I feel like I could lift a small house.;;;;;;;;;x 
EVTOPTB_WOL_11206;I feel like I could lift a small horse.;;;;;;;;;x 
EVTTOOLTIPWOLWARPROGRESS;[This.GetBestName] is increasing [This.GetHerHis] efforts to become a warrior.;;;;;;;;;x 
opinion_held_contest;Held Contest;;;;;;;;;x 
opinion_fled_duel;Fled a Just Duel;;;;;;;;;x 
wol_warrior;Warrior;;;;;;;;;x 
desc_wol_warrior;This character is known for being proficient at personal combat.;;;;;;;;;x 
wol_great_warrior;Great Warrior;;;;;;;;;x 
desc_wol_great_warrior;This character is known for being proficient at personal combat.;;;;;;;;;x 
despised_aristocrat;Despised Aristocrat;;;;;;;;;x 
desc_despised_aristocrat;This character has been denying the ordinary population their rights.;;;;;;;;;x 
recent_duel_victory;Duel Victory;;;;;;;;;x 
desc_recent_duel_victory;This character has recently defeated another person in a duel.;;;;;;;;;x 
duel_decision;Duel;;;;;;;;;x 
duel_decision_desc;Challenge §Y[This.GetTitledFirstName]§! to a duel to uphold your honor. Duels can be considered dangerous to your health.;;;;;;;;;x 
tower_start;We will begin with the necessary preparations for the construction.;;;;;;;;;x 
nick_the_headless;the Headless;;;;;;;;;x 
construction_accident;Construction Accident;;;;;;;;;x 
desc_construction_accident;An accident that could've been avoided angers the population of [This.GetName].;;;;;;;;;x 
outlawed_guild;Outlawed Guild;;;;;;;;;x 
desc_outlawed_guild;The cities in this province had one of the major guilds outlawed.;;;;;;;;;x 
carpenters_guild;Carpenters Guild;;;;;;;;;x 
desc_carpenters_guild;There's a prominent Carpenters Guild in this province making construction fast and cheap.;;;;;;;;;x 
nick_the_ruthless;the Ruthless;;;;;;;;;x 
nick_the_beheader;the Beheader;;;;;;;;;x 
EVTTOOLTIPWOL10302;Your §YDynasty§! will appreciate this gesture.;;;;;;;;;x 
opinion_ruthless;Ruthless;;;;;;;;;x 
EVTTOOLTIPWOL11006;People will be upset about this merciless action.\n;;;;;;;;;x 
EVTDESC_WOL_10401;As your efforts of gaining wealth grow all the more determined, you sleep less and less, since sleeping is not a profitable behavior.;;;;;;;;;x 
EVTOPTA_WOL_10401;I must have more gold!;;;;;;;;;x 
aspiring_gardener;Aspiring Gardener;;;;;;;;;x 
desc_aspiring_gardener;This character has taken an interest in gardening.;;;;;;;;;x 
EVTDESC_WOL_10430;[From.GetTitledFirstName] approaches you and presents to you a request to buy a small plot of your land in [Root.Capital.GetName]. This is a grievous decision for you, since he promises to pay well for the land.;;;;;;;;;x 
EVTOPTA_WOL_10430;I do need the gold...;;;;;;;;;x 
EVTOPTB_WOL_10430;There's not enough gold in your pockets to buy my land.;;;;;;;;;x 
EVTDESC_WOL_10420;You have been presented with an opportunity to let everyone be reminded of your rulership. If you wish to mint new coins for your realm, there is a master of the craft that you can hire. Not only will the mintage be exquisite, it will be adorned with a glorious portrait of you.;;;;;;;;;x 
EVTOPTA_WOL_10420;Mint the coins for glory.;;;;;;;;;x 
EVTOPTB_WOL_10420;Debase the mints with less precious metals for profits.;;;;;;;;;x 
EVTOPTC_WOL_10420;No, there's no need for additional currencies.;;;;;;;;;x 
EVTDESC_WOL_10421;A merchant has managed to find out that the coins you had minted are counterfeit. You are being called a cheapskate, since they do not contain the precious metals that they were supposed to consist of.;;;;;;;;;x 
EVTOPTA_WOL_10421;People might taunt my face on those coins now.;;;;;;;;;x 
EVTDESC_WOL_10440;A group of craftsmen has come to your court and shown off their work. They present you with fine goods, of which you are sure there would be a demand for in the realm. Noticing your interest, the craftsmen ask for some capital to start up a workshop, saying they lack the funds to do it on their own.;;;;;;;;;x 
EVTOPTA_WOL_10440;This is a sound investment.;;;;;;;;;x 
EVTTOOLTIPWOL10440;A workshop will set up in [From.GetName], and begin preparation for producing goods.;;;;;;;;;x 
EVTOPTB_WOL_10440;No. Your lack of funds is not my problem.;;;;;;;;;x 
EVTDESC_WOL_10441;The craftsmen that you funded a couple of years ago have returned to tell you of their success. With your support they were able to set up their buisness, and it's now one of the most profitable enterprises in [FromFrom.GetName].;;;;;;;;;x 
EVTOPTA_WOL_10441;Great! More taxes for me.;;;;;;;;;x 
EVTDESC_WOL_10442;There's a faint knock on your door, followed by a small figure peeking into the room. You remember him well, it's one of the craftsmen that you funded a couple of years ago. He shamefully tells you that the enterprise didn't go exactly as planned, and that their workshop is now bankrupt, with nothing to show for it.;;;;;;;;;x 
EVTOPTA_WOL_10442;That was a bad investment...;;;;;;;;;x 
EVTDESC_WOL_10410;There's a group of carpenters in [From.GetName] that are working together more and more, as well as taking on apprentices. This is a situation that cannot be ignored, and so you need to either approve of this carpenters' guild to ensure you have a good reputation amongst the skilled workers, or you could outlaw them to make sure that they're not an impediment on the local market structure.;;;;;;;;;x 
EVTOPTA_WOL_10410;I'll support the carpenters.;;;;;;;;;x 
EVTOPTB_WOL_10410;Outlaw the guilds.;;;;;;;;;x 
artisan_workshop;Artisan Workshop;;;;;;;;;x 
desc_artisan_workshop;A workshop in this province provide goods of high-quality.;;;;;;;;;x 
sold_off_land;Sold off Land to Burgher;;;;;;;;;x 
desc_sold_off_land;The ruler has sold of valuable land for short term profits.;;;;;;;;;x 
#EVTDESC_WOL_10999;After roaming around for months in unknown areas, following a map that you cannot make much sense of, you decide to give up on trying to find a realm to engage in trade with.;;;;;;;;;x 
#EVTOPTA_WOL_10999;Time to find our way home then.;;;;;;;;;x 
EVTDESC_WOL_10500;Ever since your pursuit of wealth began and you started keeping a close eye on both income and expenses, your coffers seems to be filled to the brim more often than not.;;;;;;;;;x 
EVTOPTA_WOL_10500;A thriving economy is good for the realm.;;;;;;;;;x 
